{
  "$schema": "https://json-schema.org/draft/2020-12/schema",
  "$id": "urn:uu-prism:record:2.1.1",
  "title": "Admitted single-holder metadata record",
  "type": "object",
  "required": [
    "assertion_kind",
    "byte_size",
    "facet_id",
    "holder_ref",
    "link_status",
    "observed_at",
    "payload_sha256",
    "permission",
    "received_at",
    "record_id",
    "source_kind",
    "source_ref"
  ],
  "additionalProperties": false,
  "properties": {
    "record_id": {
      "type": "string",
      "minLength": 1,
      "maxLength": 240
    },
    "holder_ref": {
      "type": "string",
      "minLength": 1,
      "maxLength": 240
    },
    "source_ref": {
      "type": "string",
      "minLength": 1,
      "maxLength": 240
    },
    "permission_ref": {
      "type": "string",
      "minLength": 1,
      "maxLength": 240
    },
    "facet_id": {
      "enum": [
        "F01",
        "F02",
        "F03",
        "F04",
        "F05",
        "F06",
        "F07",
        "F08",
        "F09",
        "F10",
        "F11",
        "F12",
        "F13",
        "F14",
        "F15",
        "F16",
        "F17",
        "F18",
        "F19",
        "F20",
        "F21",
        "F22",
        "F23",
        "F24",
        "F25",
        "F26",
        "F27",
        "F28",
        "F29",
        "F30",
        "F31",
        "F32",
        "F33",
        "F34",
        "F35"
      ]
    },
    "source_kind": {
      "enum": [
        "synthetic",
        "holder_export",
        "holder_measurement",
        "holder_declaration"
      ]
    },
    "permission": {
      "const": "granted"
    },
    "link_status": {
      "const": "holder_confirmed"
    },
    "received_at": {
      "type": "string",
      "pattern": "^\\d{4}-\\d{2}-\\d{2}T.*Z$"
    },
    "observed_at": {
      "anyOf": [
        {
          "type": "string",
          "pattern": "^\\d{4}-\\d{2}-\\d{2}T.*Z$"
        },
        {
          "type": "null"
        }
      ]
    },
    "payload_sha256": {
      "type": "string",
      "pattern": "^[0-9a-f]{64}$"
    },
    "byte_size": {
      "type": "integer",
      "minimum": 0,
      "maximum": 9007199254740991
    },
    "supersedes": {
      "type": [
        "string",
        "null"
      ],
      "pattern": "^[0-9a-f]{64}$"
    },
    "assertion_kind": {
      "enum": [
        "source_record",
        "measurement",
        "self_report",
        "synthetic"
      ]
    }
  },
  "allOf": [
    {
      "if": {
        "properties": {
          "facet_id": {
            "const": "F30"
          }
        }
      },
      "then": {
        "properties": {
          "assertion_kind": {
            "enum": [
              "self_report",
              "synthetic"
            ]
          }
        }
      }
    }
  ]
}
