[
  {
    "record_id": "demo:F01",
    "holder_ref": "holder:synthetic-001",
    "facet_id": "F01",
    "source_ref": "synthetic:object:0",
    "source_kind": "synthetic",
    "permission": "granted",
    "permission_ref": "synthetic:grant:001",
    "link_status": "holder_confirmed",
    "observed_at": "2024-06-01T08:00:00Z",
    "received_at": "2026-09-11T11:59:00Z",
    "payload_sha256": "900e0f9bf7becc0f04fa33cfcc68d6f1c9858276b3be3efb7662ace0224347ea",
    "byte_size": 48,
    "assertion_kind": "synthetic"
  },
  {
    "record_id": "demo:F02",
    "holder_ref": "holder:synthetic-001",
    "facet_id": "F02",
    "source_ref": "synthetic:object:0",
    "source_kind": "synthetic",
    "permission": "granted",
    "permission_ref": "synthetic:grant:001",
    "link_status": "holder_confirmed",
    "observed_at": "2024-06-01T08:00:00Z",
    "received_at": "2026-09-11T11:59:01Z",
    "payload_sha256": "900e0f9bf7becc0f04fa33cfcc68d6f1c9858276b3be3efb7662ace0224347ea",
    "byte_size": 48,
    "assertion_kind": "synthetic"
  },
  {
    "record_id": "demo:F03",
    "holder_ref": "holder:synthetic-001",
    "facet_id": "F03",
    "source_ref": "synthetic:object:2",
    "source_kind": "synthetic",
    "permission": "granted",
    "permission_ref": "synthetic:grant:001",
    "link_status": "holder_confirmed",
    "observed_at": "2026-09-11T11:59:45Z",
    "received_at": "2026-09-11T11:59:02Z",
    "payload_sha256": "f7575d81ffbd8e8eba812efe6374c6c73d1d903ce05b71d43fcbe44bd42aaf61",
    "byte_size": 48,
    "assertion_kind": "synthetic"
  },
  {
    "record_id": "demo:F06",
    "holder_ref": "holder:synthetic-001",
    "facet_id": "F06",
    "source_ref": "synthetic:object:3",
    "source_kind": "synthetic",
    "permission": "granted",
    "permission_ref": "synthetic:grant:001",
    "link_status": "holder_confirmed",
    "observed_at": "2026-09-11T11:59:45Z",
    "received_at": "2026-09-11T11:59:03Z",
    "payload_sha256": "af3c3be44f472b7e1120108d1242b751b2de4443d2b538a51c3ef2d9aa3e271d",
    "byte_size": 48,
    "assertion_kind": "synthetic"
  },
  {
    "record_id": "demo:F08",
    "holder_ref": "holder:synthetic-001",
    "facet_id": "F08",
    "source_ref": "synthetic:object:4",
    "source_kind": "synthetic",
    "permission": "granted",
    "permission_ref": "synthetic:grant:001",
    "link_status": "holder_confirmed",
    "observed_at": "2026-09-11T12:00:15Z",
    "received_at": "2026-09-11T11:59:04Z",
    "payload_sha256": "5e60f5797e5a3936fa0ae32e0efce52bec9c802eb8998090c311b07eb025d517",
    "byte_size": 48,
    "assertion_kind": "synthetic"
  },
  {
    "record_id": "demo:F11",
    "holder_ref": "holder:synthetic-001",
    "facet_id": "F11",
    "source_ref": "synthetic:object:5",
    "source_kind": "synthetic",
    "permission": "granted",
    "permission_ref": "synthetic:grant:001",
    "link_status": "holder_confirmed",
    "observed_at": "2026-09-11T11:59:45Z",
    "received_at": "2026-09-11T11:59:05Z",
    "payload_sha256": "2ea1bb821612d67ad32861ed6e2e7a24a8da2b43ad01ea3da77ebcd950e9273f",
    "byte_size": 48,
    "assertion_kind": "synthetic"
  },
  {
    "record_id": "demo:F13",
    "holder_ref": "holder:synthetic-001",
    "facet_id": "F13",
    "source_ref": "synthetic:object:6",
    "source_kind": "synthetic",
    "permission": "granted",
    "permission_ref": "synthetic:grant:001",
    "link_status": "holder_confirmed",
    "observed_at": "2026-09-11T11:59:45Z",
    "received_at": "2026-09-11T11:59:06Z",
    "payload_sha256": "ea5aa83ce2e0d7fe0d1c3c0908e4cd0c021d865ee13946121b6488a4fcf4f007",
    "byte_size": 48,
    "assertion_kind": "synthetic"
  },
  {
    "record_id": "demo:F16",
    "holder_ref": "holder:synthetic-001",
    "facet_id": "F16",
    "source_ref": "synthetic:object:7",
    "source_kind": "synthetic",
    "permission": "granted",
    "permission_ref": "synthetic:grant:001",
    "link_status": "holder_confirmed",
    "observed_at": "2026-09-11T11:59:45Z",
    "received_at": "2026-09-11T11:59:07Z",
    "payload_sha256": "8eec52a285c11376a6bd9183053319a6355183d5c2162a3d427d71eb4a2c3187",
    "byte_size": 48,
    "assertion_kind": "synthetic"
  },
  {
    "record_id": "demo:F19",
    "holder_ref": "holder:synthetic-001",
    "facet_id": "F19",
    "source_ref": "synthetic:object:8",
    "source_kind": "synthetic",
    "permission": "granted",
    "permission_ref": "synthetic:grant:001",
    "link_status": "holder_confirmed",
    "observed_at": "2026-09-11T11:59:45Z",
    "received_at": "2026-09-11T11:59:08Z",
    "payload_sha256": "f29f44704cbe96daf4f9fcb3532f6a718df42f86a40639cf0fece082124cc7ae",
    "byte_size": 48,
    "assertion_kind": "synthetic"
  },
  {
    "record_id": "demo:F21",
    "holder_ref": "holder:synthetic-001",
    "facet_id": "F21",
    "source_ref": "synthetic:object:9",
    "source_kind": "synthetic",
    "permission": "granted",
    "permission_ref": "synthetic:grant:001",
    "link_status": "holder_confirmed",
    "observed_at": "2026-09-11T11:59:45Z",
    "received_at": "2026-09-11T11:59:09Z",
    "payload_sha256": "9ddac26e12501b2063558ea89cf98ec34c4dbf5cc95a27b063519493a769222d",
    "byte_size": 48,
    "assertion_kind": "synthetic"
  },
  {
    "record_id": "demo:F24",
    "holder_ref": "holder:synthetic-001",
    "facet_id": "F24",
    "source_ref": "synthetic:object:10",
    "source_kind": "synthetic",
    "permission": "granted",
    "permission_ref": "synthetic:grant:001",
    "link_status": "holder_confirmed",
    "observed_at": "2026-09-11T11:59:45Z",
    "received_at": "2026-09-11T11:59:10Z",
    "payload_sha256": "019efdecc176585e2dcdef0f68217f82c4b76fb61338c1a5479edbf3cd25c05f",
    "byte_size": 49,
    "assertion_kind": "synthetic"
  },
  {
    "record_id": "demo:F26",
    "holder_ref": "holder:synthetic-001",
    "facet_id": "F26",
    "source_ref": "synthetic:object:11",
    "source_kind": "synthetic",
    "permission": "granted",
    "permission_ref": "synthetic:grant:001",
    "link_status": "holder_confirmed",
    "observed_at": "2024-06-01T08:00:00Z",
    "received_at": "2026-09-11T11:59:11Z",
    "payload_sha256": "f1c7952d7f106aa6552d47cbced6acd19dc772e5f2378c972182e51499d53fbc",
    "byte_size": 49,
    "assertion_kind": "synthetic"
  },
  {
    "record_id": "demo:F27",
    "holder_ref": "holder:synthetic-001",
    "facet_id": "F27",
    "source_ref": "synthetic:object:12",
    "source_kind": "synthetic",
    "permission": "granted",
    "permission_ref": "synthetic:grant:001",
    "link_status": "holder_confirmed",
    "observed_at": "2026-09-11T11:59:45Z",
    "received_at": "2026-09-11T11:59:12Z",
    "payload_sha256": "4ad67cdff182c3c1e667bcdd66396b4e3ddbff1cffcf80ac584bf7c445383f0b",
    "byte_size": 49,
    "assertion_kind": "synthetic"
  },
  {
    "record_id": "demo:F30",
    "holder_ref": "holder:synthetic-001",
    "facet_id": "F30",
    "source_ref": "synthetic:object:13",
    "source_kind": "synthetic",
    "permission": "granted",
    "permission_ref": "synthetic:grant:001",
    "link_status": "holder_confirmed",
    "observed_at": null,
    "received_at": "2026-09-11T11:59:13Z",
    "payload_sha256": "e276536facaf6377ee4380e8a843ab8bdce969b4f95b92b60a80105bf30255ff",
    "byte_size": 49,
    "assertion_kind": "synthetic"
  },
  {
    "record_id": "demo:F31",
    "holder_ref": "holder:synthetic-001",
    "facet_id": "F31",
    "source_ref": "synthetic:object:14",
    "source_kind": "synthetic",
    "permission": "granted",
    "permission_ref": "synthetic:grant:001",
    "link_status": "holder_confirmed",
    "observed_at": "2026-09-11T11:59:45Z",
    "received_at": "2026-09-11T11:59:14Z",
    "payload_sha256": "4181ef4dd556badc11ada4713cb3d2c3025d2e76d3e07a7ce1e858e0dded21a6",
    "byte_size": 49,
    "assertion_kind": "synthetic"
  },
  {
    "record_id": "demo:F35",
    "holder_ref": "holder:synthetic-001",
    "facet_id": "F35",
    "source_ref": "synthetic:object:15",
    "source_kind": "synthetic",
    "permission": "granted",
    "permission_ref": "synthetic:grant:001",
    "link_status": "holder_confirmed",
    "observed_at": "2026-09-11T11:59:45Z",
    "received_at": "2026-09-11T11:59:15Z",
    "payload_sha256": "4f90541c0fc5c3782cd3fb58ab57ed87a8dd17eca0d2f5094946f1210535f86c",
    "byte_size": 49,
    "assertion_kind": "synthetic"
  }
]
